Poster_Link,Series_Title,Released_Year,Certificate,Runtime,Genre,IMDB_Rating,Overview,Meta_score,Director,Director_DOB,Director_Country_Origin,Director_Movies_directed,No_of_Votes,Gross
"https://m.media-amazon.com/images/M/MV5BMDFkYTc0MGEtZmNhMC00ZDIzLWFmNTEtODM1ZmRlYWMwMWFmXkEyXkFqcGdeQXVyMTMxODk2OTU@._V1_UX67_CR0,0,67,98_AL_.jpg",The Shawshank Redemption,1994,A,142,Drama,9.3,"Two imprisoned men bond over a number of years, finding solace and eventual redemption through acts of common decency.",80,Frank Darabont,1959-01-28,USA,3,2343110,28.341.469
"https://m.media-amazon.com/images/M/MV5BM2MyNjYxNmUtYTAwNi00MTYxLWJmNWYtYzZlODY3ZTk3OTFlXkEyXkFqcGdeQXVyNzkwMjQ5NzM@._V1_UY98_CR1,0,67,98_AL_.jpg",The Godfather,1972,A,175,"Crime, Drama",9.2,An organized crime dynasty's aging patriarch transfers control of his clandestine empire to his reluctant son.,100,Francis Ford Coppola,1939-04-07,USA,6,1620367,134.966.411
"https://m.media-amazon.com/images/M/MV5BMTMxNTMwODM0NF5BMl5BanBnXkFtZTcwODAyMTk2Mw@@._V1_UX67_CR0,0,67,98_AL_.jpg",The Dark Knight,2008,UA,152,"Action, Crime, Drama",9.0,"When the menace known as the Joker wreaks havoc and chaos on the people of Gotham, Batman must accept one of the greatest psychological and physical tests of his ability to fight injustice.",84,Christopher Nolan,1970-07-30,UK,10,2303232,534.858.444
"https://m.media-amazon.com/images/M/MV5BMWMwMGQzZTItY2JlNC00OWZiLWIyMDctNDk2ZDQ2YjRjMWQ0XkEyXkFqcGdeQXVyNzkwMjQ5NzM@._V1_UY98_CR1,0,67,98_AL_.jpg",The Godfather: Part II,1974,A,202,"Crime, Drama",9.0,"The early life and career of Vito Corleone in 1920s New York City is portrayed, while his son, Michael, expands and tightens his grip on the family crime syndicate.",90,Francis Ford Coppola,1939-04-07,USA,6,1129952,57.300.000
"https://m.media-amazon.com/images/M/MV5BMWU4N2FjNzYtNTVkNC00NzQ0LTg0MjAtYTJlMjFhNGUxZDFmXkEyXkFqcGdeQXVyNjc1NTYyMjg@._V1_UX67_CR0,0,67,98_AL_.jpg",12 Angry Men,1957,U,96,"Crime, Drama",9.0,A jury holdout attempts to prevent a miscarriage of justice by forcing his colleagues to reconsider the evidence.,96,Sidney Lumet,1924-06-25,USA,44,689845,4.360.000
"https://m.media-amazon.com/images/M/MV5BNzA5ZDNlZWMtM2NhNS00NDJjLTk4NDItYTRmY2EwMWZlMTY3XkEyXkFqcGdeQXVyNzkwMjQ5NzM@._V1_UX67_CR0,0,67,98_AL_.jpg",The Lord of the Rings: The Return of the King,2003,U,201,"Action, Adventure, Drama",8.9,Gandalf and Aragorn lead the World of Men against Sauron's army to draw his gaze from Frodo and Sam as they approach Mount Doom with the One Ring.,94,Peter Jackson,1961-10-31,New Zealand,15,1642758,377.845.905
"https://m.media-amazon.com/images/M/MV5BNGNhMDIzZTUtNTBlZi00MTRlLWFjM2ItYzViMjE3YzI5MjljXkEyXkFqcGdeQXVyNzkwMjQ5NzM@._V1_UY98_CR0,0,67,98_AL_.jpg",Pulp Fiction,1994,A,154,"Crime, Drama",8.9,"The lives of two mob hitmen, a boxer, a gangster and his wife, and a pair of diner bandits intertwine in four tales of violence and redemption.",94,Quentin Tarantino,1963-03-27,USA,10,1826188,107.928.762
"https://m.media-amazon.com/images/M/MV5BNDE4OTMxMTctNmRhYy00NWE2LTg3YzItYTk3M2UwOTU5Njg4XkEyXkFqcGdeQXVyNjU0OTQ0OTY@._V1_UX67_CR0,0,67,98_AL_.jpg",Schindler's List,1993,A,195,"Biography, Drama, History",8.9,"In German-occupied Poland during World War II, industrialist Oskar Schindler gradually becomes concerned for his Jewish workforce after witnessing their persecution by the Nazis.",94,Steven Spielberg,1946-12-18,USA,34,1213505,96.898.818
"https://m.media-amazon.com/images/M/MV5BMjAxMzY3NjcxNF5BMl5BanBnXkFtZTcwNTI5OTM0Mw@@._V1_UX67_CR0,0,67,98_AL_.jpg",Inception,2010,UA,148,"Action, Adventure, Sci-Fi",8.8,A thief who steals corporate secrets through the use of dream-sharing technology is given the inverse task of planting an idea into the mind of a C.E.O.,74,Christopher Nolan,1970-07-30,UK,10,2067042,292.576.195
"https://m.media-amazon.com/images/M/MV5BMmEzNTkxYjQtZTc0MC00YTVjLTg5ZTEtZWMwOWVlYzY0NWIwXkEyXkFqcGdeQXVyNzkwMjQ5NzM@._V1_UX67_CR0,0,67,98_AL_.jpg",Fight Club,1999,A,139,Drama,8.8,"An insomniac office worker and a devil-may-care soapmaker form an underground fight club that evolves into something much, much more.",66,David Fincher,1962-08-28,USA,11,1854740,37.030.102
"https://m.media-amazon.com/images/M/MV5BN2EyZjM3NzUtNWUzMi00MTgxLWI0NTctMzY4M2VlOTdjZWRiXkEyXkFqcGdeQXVyNDUzOTQ5MjY@._V1_UX67_CR0,0,67,98_AL_.jpg",The Lord of the Rings: The Fellowship of the Ring,2001,U,178,"Action, Adventure, Drama",8.8,A meek Hobbit from the Shire and eight companions set out on a journey to destroy the powerful One Ring and save Middle-earth from the Dark Lord Sauron.,92,Peter Jackson,1961-10-31,New Zealand,15,1661481,315.544.750
"https://m.media-amazon.com/images/M/MV5BNWIwODRlZTUtY2U3ZS00Yzg1LWJhNzYtMmZiYmEyNmU1NjMzXkEyXkFqcGdeQXVyMTQxNzMzNDI@._V1_UY98_CR0,0,67,98_AL_.jpg",Forrest Gump,1994,UA,142,"Drama, Romance",8.8,"The presidencies of Kennedy and Johnson, the events of Vietnam, Watergate and other historical events unfold through the perspective of an Alabama man with an IQ of 75, whose only desire is to be reunited with his childhood sweetheart.",82,Robert Zemeckis,1951-05-14,USA,21,1809221,330.252.182
"https://m.media-amazon.com/images/M/MV5BOTQ5NDI3MTI4MF5BMl5BanBnXkFtZTgwNDQ4ODE5MDE@._V1_UX67_CR0,0,67,98_AL_.jpg","Il buono, il brutto, il cattivo",1966,A,161,Western,8.8,A bounty hunting scam joins two men in an uneasy alliance against a third in a race to find a fortune in gold buried in a remote cemetery.,90,Sergio Leone,1929-01-03,Italy,12,688390,6.100.000
"https://m.media-amazon.com/images/M/MV5BZGMxZTdjZmYtMmE2Ni00ZTdkLWI5NTgtNjlmMjBiNzU2MmI5XkEyXkFqcGdeQXVyNjU0OTQ0OTY@._V1_UX67_CR0,0,67,98_AL_.jpg",The Lord of the Rings: The Two Towers,2002,UA,179,"Action, Adventure, Drama",8.7,"While Frodo and Sam edge closer to Mordor with the help of the shifty Gollum, the divided fellowship makes a stand against Sauron's new ally, Saruman, and his hordes of Isengard.",87,Peter Jackson,1961-10-31,New Zealand,15,1485555,342.551.365
"https://m.media-amazon.com/images/M/MV5BNzQzOTk3OTAtNDQ0Zi00ZTVkLWI0MTEtMDllZjNkYzNjNTc4L2ltYWdlXkEyXkFqcGdeQXVyNjU0OTQ0OTY@._V1_UX67_CR0,0,67,98_AL_.jpg",The Matrix,1999,A,136,"Action, Sci-Fi",8.7,"When a beautiful stranger leads computer hacker Neo to a forbidding underworld, he discovers the shocking truth--the life he knows is the elaborate deception of an evil cyber-intelligence.",73,Lana Wachowski,1965-06-21,USA,8,1676426,171.479.930
"https://m.media-amazon.com/images/M/MV5BY2NkZjEzMDgtN2RjYy00YzM1LWI4ZmQtMjIwYjFjNmI3ZGEwXkEyXkFqcGdeQXVyNzkwMjQ5NzM@._V1_UX67_CR0,0,67,98_AL_.jpg",Goodfellas,1990,A,146,"Biography, Crime, Drama",8.7,"The story of Henry Hill and his life in the mob, covering his relationship with his wife Karen Hill and his mob partners Jimmy Conway and Tommy DeVito in the Italian-American crime syndicate.",90,Martin Scorsese,1942-11-17,USA,25,1020727,46.836.394
"https://m.media-amazon.com/images/M/MV5BYmU1NDRjNDgtMzhiMi00NjZmLTg5NGItZDNiZjU5NTU4OTE0XkEyXkFqcGdeQXVyNzkwMjQ5NzM@._V1_UX67_CR0,0,67,98_AL_.jpg",Star Wars: Episode V - The Empire Strikes Back,1980,UA,124,"Action, Adventure, Fantasy",8.7,"After the Rebels are brutally overpowered by the Empire on the ice planet Hoth, Luke Skywalker begins Jedi training with Yoda, while his friends are pursued by Darth Vader and a bounty hunter named Boba Fett all over the galaxy.",82,Irvin Kershner,1923-04-29,USA,11,1159315,290.475.067
"https://m.media-amazon.com/images/M/MV5BZjA0OWVhOTAtYWQxNi00YzNhLWI4ZjYtNjFjZTEyYjJlNDVlL2ltYWdlL2ltYWdlXkEyXkFqcGdeQXVyMTQxNzMzNDI@._V1_UX67_CR0,0,67,98_AL_.jpg",One Flew Over the Cuckoo's Nest,1975,A,133,Drama,8.7,"A crial pleads insanity and is admitted to a mental institution, where he rebels against the oppressive nurse and rallies up the scared patients.",83,Milos Forman,1932-02-18,Czech Republic,17,918088,112.000.000
"https://m.media-amazon.com/images/M/MV5BNjViNWRjYWEtZTI0NC00N2E3LTk0NGQtMjY4NTM3OGNkZjY0XkEyXkFqcGdeQXVyMjUxMTY3ODM@._V1_UX67_CR0,0,67,98_AL_.jpg",Hamilton,2020,PG-13,160,"Biography, Drama, History",8.6,"The real life of one of America's foremost founding fathers and first Secretary of the Treasury, Alexander Hamilton. Captured live on Broadway from the Richard Rodgers Theater with the original Broadway cast.",90,Thomas Kail,1977-01-20,USA,1,55291,817.000.000
"https://m.media-amazon.com/images/M/MV5BYWZjMjk3ZTItODQ2ZC00NTY5LWE0ZDYtZTI3MjcwN2Q5NTVkXkEyXkFqcGdeQXVyODk4OTc3MTY@._V1_UX67_CR0,0,67,98_AL_.jpg",Gisaengchung,2019,A,132,"Comedy, Drama, Thriller",8.6,Greed and class discrimination threaten the newly formed symbiotic relationship between the wealthy Park family and the destitute Kim clan.,96,Bong Joon Ho,1969-09-14,South Korea,7,552778,53.367.844
"https://m.media-amazon.com/images/M/MV5BOTc2ZTlmYmItMDBhYS00YmMzLWI4ZjAtMTI5YTBjOTFiMGEwXkEyXkFqcGdeQXVyODE5NzE3OTE@._V1_UY98_CR0,0,67,98_AL_.jpg",Soorarai Pottru,2020,U,153,Drama,8.6,"Nedumaaran Rajangam ""Maara"" sets out to make the common man fly and in the process takes on the world's most capital intensive industry and several enemies who stand in his way.",70,Sudha Kongara,1971-03-29,India,3,54995,0
"https://m.media-amazon.com/images/M/MV5BZjdkOTU3MDktN2IxOS00OGEyLWFmMjktY2FiMmZkNWIyODZiXkEyXkFqcGdeQXVyMTMxODk2OTU@._V1_UX67_CR0,0,67,98_AL_.jpg",Interstellar,2014,UA,169,"Adventure, Drama, Sci-Fi",8.6,A team of explorers travel through a wormhole in space in an attempt to ensure humanity's survival.,74,Christopher Nolan,1970-07-30,UK,10,1512360,188.020.017
"https://m.media-amazon.com/images/M/MV5BOTMwYjc5ZmItYTFjZC00ZGQ3LTlkNTMtMjZiNTZlMWQzNzI5XkEyXkFqcGdeQXVyNzkwMjQ5NzM@._V1_UX67_CR0,0,67,98_AL_.jpg",Cidade de Deus,2002,A,130,"Crime, Drama",8.6,"In the slums of Rio, two kids' paths diverge as one struggles to become a photographer and the other a kingpin.",79,Fernando Meirelles,1955-11-09,Brazil,8,699256,7.563.397
"https://m.media-amazon.com/images/M/MV5BMjlmZmI5MDctNDE2YS00YWE0LWE5ZWItZDBhYWQ0NTcxNWRhXkEyXkFqcGdeQXVyMTMxODk2OTU@._V1_UX67_CR0,0,67,98_AL_.jpg",Sen to Chihiro no kamikakushi,2001,U,125,"Animation, Adventure, Family",8.6,"During her family's move to the suburbs, a sullen 10-year-old girl wanders into a world ruled by gods, witches, and spirits, and where humans are changed into beasts.",96,Hayao Miyazaki,1941-01-05,Japan,11,651376,10.055.859
"https://m.media-amazon.com/images/M/MV5BZjhkMDM4MWItZTVjOC00ZDRhLThmYTAtM2I5NzBmNmNlMzI1XkEyXkFqcGdeQXVyNDYyMDk5MTU@._V1_UX67_CR0,0,67,98_AL_.jpg",Saving Private Ryan,1998,R,169,"Drama, War",8.6,"Following the Normandy Landings, a group of U.S. soldiers go behind enemy lines to retrieve a paratrooper whose brothers have been killed in action.",91,Steven Spielberg,1946-12-18,USA,34,1235804,216.540.909
"https://m.media-amazon.com/images/M/MV5BMTUxMzQyNjA5MF5BMl5BanBnXkFtZTYwOTU2NTY3._V1_UX67_CR0,0,67,98_AL_.jpg",The Green Mile,1999,A,189,"Crime, Drama, Fantasy",8.6,"The lives of guards on Death Row are affected by one of their charges: a black man accused of child murder and rape, yet who has a mysterious gift.",61,Frank Darabont,1959-01-28,USA,3,1147794,136.801.374
"https://m.media-amazon.com/images/M/MV5BYmJmM2Q4NmMtYThmNC00ZjRlLWEyZmItZTIwOTBlZDQ3NTQ1XkEyXkFqcGdeQXVyMTQxNzMzNDI@._V1_UX67_CR0,0,67,98_AL_.jpg",La vita è bella,1997,U,116,"Comedy, Drama, Romance",8.6,"When an open-ded Jewish librarian and his son become victims of the Holocaust, he uses a perfect mixture of will, humor, and imagination to protect his son from the dangers around their camp.",59,Roberto Benigni,1952-10-27,Italy,5,623629,57.598.247
"https://m.media-amazon.com/images/M/MV5BOTUwODM5MTctZjczMi00OTk4LTg3NWUtNmVhMTAzNTNjYjcyXkEyXkFqcGdeQXVyNjU0OTQ0OTY@._V1_UX67_CR0,0,67,98_AL_.jpg",Se7en,1995,A,127,"Crime, Drama, Mystery",8.6,"Two detectives, a rookie and a veteran, hunt a serial killer who uses the seven deadly sins as his motives.",65,David Fincher,1962-08-28,USA,11,1445096,100.125.643
"https://m.media-amazon.com/images/M/MV5BNjNhZTk0ZmEtNjJhMi00YzFlLWE1MmEtYzM1M2ZmMGMwMTU4XkEyXkFqcGdeQXVyNjU0OTQ0OTY@._V1_UX67_CR0,0,67,98_AL_.jpg",The Silence of the Lambs,1991,A,118,"Crime, Drama, Thriller",8.6,"A young F.B.I. cadet must receive the help of an incarcerated and manipulative cannibal killer to help catch another serial killer, a madman who skins his victims.",85,Jonathan Demme,1944-02-22,USA,19,1270197,130.742.922
"https://m.media-amazon.com/images/M/MV5BNzVlY2MwMjktM2E4OS00Y2Y3LWE3ZjctYzhkZGM3YzA1ZWM2XkEyXkFqcGdeQXVyNzkwMjQ5NzM@._V1_UX67_CR0,0,67,98_AL_.jpg",Star Wars,1977,UA,121,"Action, Adventure, Fantasy",8.6,"Luke Skywalker joins forces with a Jedi Knight, a cocky pilot, a Wookiee and two droids to save the galaxy from the Empire's world-destroying battle station, while also attempting to rescue Princess Leia from the mysterious Darth Vader.",90,George Lucas,1944-05-14,USA,7,1231473,322.740.140
"https://m.media-amazon.com/images/M/MV5BYjBmYTQ1NjItZWU5MS00YjI0LTg2OTYtYmFkN2JkMmNiNWVkXkEyXkFqcGdeQXVyMTMxMTY0OTQ@._V1_UY98_CR2,0,67,98_AL_.jpg",Seppuku,1962,,133,"Action, Drama, Mystery",8.6,"When a ronin requesting seppuku at a feudal lord's palace is told of the brutal suicide of another ronin who previously visited, he reveals how their pasts are intertwined - and in doing so challenges the clan's integrity.",85,Masaki Kobayashi,1916-02-14,Japan,21,42004,0
"https://m.media-amazon.com/images/M/MV5BOWE4ZDdhNmMtNzE5ZC00NzExLTlhNGMtY2ZhYjYzODEzODA1XkEyXkFqcGdeQXVyNTAyODkwOQ@@._V1_UY98_CR1,0,67,98_AL_.jpg",Shichinin no samurai,1954,U,207,"Action, Adventure, Drama",8.6,A poor village under attack by bandits recruits seven unemployed samurai to help them defend themselves.,98,Akira Kurosawa,1910-03-23,Japan,30,315744,269.061
"https://m.media-amazon.com/images/M/MV5BZjc4NDZhZWMtNGEzYS00ZWU2LThlM2ItNTA0YzQ0OTExMTE2XkEyXkFqcGdeQXVyNjUwMzI2NzU@._V1_UY98_CR0,0,67,98_AL_.jpg",It's a Wonderful Life,1946,PG,130,"Drama, Family, Fantasy",8.6,An angel is sent from Heaven to help a desperately frustrated businessman by showing him what life would have been like if he had never existed.,89,Frank Capra,1897-05-18,USA,51,405801,0
"https://m.media-amazon.com/images/M/MV5BNGVjNWI4ZGUtNzE0MS00YTJmLWE0ZDctN2ZiYTk2YmI3NTYyXkEyXkFqcGdeQXVyMTkxNjUyNQ@@._V1_UX67_CR0,0,67,98_AL_.jpg",Joker,2019,A,122,"Crime, Drama, Thriller",8.5,"In Gotham City, mentally troubled comedian Arthur Fleck is disregarded and mistreated by society. He then embarks on a downward spiral of revolution and bloody crime. This path brings him face-to-face with his alter-ego: the Joker.",59,Todd Phillips,1970-12-20,USA,13,939252,335.451.311
"https://m.media-amazon.com/images/M/MV5BOTA5NDZlZGUtMjAxOS00YTRkLTkwYmMtYWQ0NWEwZDZiNjEzXkEyXkFqcGdeQXVyMTMxODk2OTU@._V1_UX67_CR0,0,67,98_AL_.jpg",Whiplash,2014,A,106,"Drama, Music",8.5,A promising young drummer enrolls at a cut-throat music conservatory where his dreams of greatness are mentored by an instructor who will stop at nothing to realize a student's potential.,88,Damien Chazelle,1985-01-19,USA,4,717585,13.092.000
"https://m.media-amazon.com/images/M/MV5BMTYxNDA3MDQwNl5BMl5BanBnXkFtZTcwNTU4Mzc1Nw@@._V1_UX67_CR0,0,67,98_AL_.jpg",The Intouchables,2011,UA,112,"Biography, Comedy, Drama",8.5,"After he becomes a quadriplegic from a paragliding accident, an aristocrat hires a young man from the projects to be his caregiver.",57,Olivier Nakache,1973-04-15,France,12,760360,13.182.281
"https://m.media-amazon.com/images/M/MV5BMjA4NDI0MTIxNF5BMl5BanBnXkFtZTYwNTM0MzY2._V1_UX67_CR0,0,67,98_AL_.jpg",The Prestige,2006,U,130,"Drama, Mystery, Sci-Fi",8.5,"After a tragic accident, two stage magicians engage in a battle to create the ultimate illusion while sacrificing everything they have to outwit each other.",66,Christopher Nolan,1970-07-30,UK,10,1190259,53.089.891
"https://m.media-amazon.com/images/M/MV5BMTI1MTY2OTIxNV5BMl5BanBnXkFtZTYwNjQ4NjY3._V1_UX67_CR0,0,67,98_AL_.jpg",The Departed,2006,A,151,"Crime, Drama, Thriller",8.5,An undercover cop and a mole in the police attempt to identify each other while infiltrating an Irish gang in South Boston.,85,Martin Scorsese,1942-11-17,USA,25,1189773,132.384.315
"https://m.media-amazon.com/images/M/MV5BOWRiZDIxZjktMTA1NC00MDQ2LWEzMjUtMTliZmY3NjQ3ODJiXkEyXkFqcGdeQXVyNjU0OTQ0OTY@._V1_UY98_CR2,0,67,98_AL_.jpg",The Pianist,2002,R,150,"Biography, Drama, Music",8.5,A Polish Jewish musician struggles to survive the destruction of the Warsaw ghetto of World War II.,85,Roman Polanski,1933-08-18,France,21,729603,32.572.577
"https://m.media-amazon.com/images/M/MV5BMDliMmNhNDEtODUyOS00MjNlLTgxODEtN2U3NzIxMGVkZTA1L2ltYWdlXkEyXkFqcGdeQXVyNjU0OTQ0OTY@._V1_UX67_CR0,0,67,98_AL_.jpg",Gladiator,2000,UA,155,"Action, Adventure, Drama",8.5,A former Roman General sets out to exact vengeance against the corrupt emperor who murdered his family and sent him into slavery.,67,Ridley Scott,1937-11-30,UK,27,1341460,187.705.427
"https://m.media-amazon.com/images/M/MV5BZjA0MTM4MTQtNzY5MC00NzY3LWI1ZTgtYzcxMjkyMzU4MDZiXkEyXkFqcGdeQXVyNDYyMDk5MTU@._V1_UX67_CR0,0,67,98_AL_.jpg",American History X,1998,R,119,Drama,8.5,A former neo-nazi skinhead tries to prevent his younger brother from going down the same wrong path that he did.,62,Tony Kaye,1952-07-08,UK,5,1034705,6.719.864
"https://m.media-amazon.com/images/M/MV5BYTViNjMyNmUtNDFkNC00ZDRlLThmMDUtZDU2YWE4NGI2ZjVmXkEyXkFqcGdeQXVyNjU0OTQ0OTY@._V1_UX67_CR0,0,67,98_AL_.jpg",The Usual Suspects,1995,A,106,"Crime, Mystery, Thriller",8.5,"A sole survivor tells of the twisty events leading up to a horrific gun battle on a boat, which began when five crials met at a seegly random police lineup.",77,Bryan Singer,1965-09-17,USA,13,991208,23.341.568
"https://m.media-amazon.com/images/M/MV5BODllNWE0MmEtYjUwZi00ZjY3LThmNmQtZjZlMjI2YTZjYmQ0XkEyXkFqcGdeQXVyNTc1NTQxODI@._V1_UX67_CR0,0,67,98_AL_.jpg",Léon,1994,A,110,"Action, Crime, Drama",8.5,"Mathilda, a 12-year-old girl, is reluctantly taken in by Léon, a professional assassin, after her family is murdered. An unusual relationship forms as she becomes his protégée and learns the assassin's trade.",64,Luc Besson,1959-03-18,France,22,1035236,19.501.238
"https://m.media-amazon.com/images/M/MV5BYTYxNGMyZTYtMjE3MS00MzNjLWFjNmYtMDk3N2FmM2JiM2M1XkEyXkFqcGdeQXVyNjY5NDU4NzI@._V1_UX67_CR0,0,67,98_AL_.jpg",The Lion King,1994,U,88,"Animation, Adventure, Drama",8.5,"Lion prince Simba and his father are targeted by his bitter uncle, who wants to ascend the throne himself.",88,Roger Allers,1949-06-29,USA,4,942045,422.783.777
"https://m.media-amazon.com/images/M/MV5BMGU2NzRmZjUtOGUxYS00ZjdjLWEwZWItY2NlM2JhNjkxNTFmXkEyXkFqcGdeQXVyNjU0OTQ0OTY@._V1_UX67_CR0,0,67,98_AL_.jpg",Terator 2: Judgment Day,1991,U,137,"Action, Sci-Fi",8.5,"A cyborg, identical to the one who failed to kill Sarah Connor, must now protect her teenage son, John Connor, from a more advanced and powerful cyborg.",75,James Cameron,1954-08-16,Canada,12,995506,204.843.350
"https://m.media-amazon.com/images/M/MV5BM2FhYjEyYmYtMDI1Yy00YTdlLWI2NWQtYmEzNzAxOGY1NjY2XkEyXkFqcGdeQXVyNTA3NTIyNDg@._V1_UX67_CR0,0,67,98_AL_.jpg",Nuovo Cinema Paradiso,1988,U,155,"Drama, Romance",8.5,A filmmaker recalls his childhood when falling in love with the pictures at the cinema of his home village and forms a deep friendship with the cinema's projectionist.,80,Giuseppe Tornatore,1956-05-27,Italy,13,230763,11.990.401
"https://m.media-amazon.com/images/M/MV5BZmY2NjUzNDQtNTgxNC00M2Q4LTljOWQtMjNjNDBjNWUxNmJlXkEyXkFqcGdeQXVyNTA4NzY1MzY@._V1_UX67_CR0,0,67,98_AL_.jpg",Hotaru no haka,1988,U,89,"Animation, Drama, War",8.5,A young boy and his little sister struggle to survive in Japan during World War II.,94,Isao Takahata,1935-08-29,Japan,5,235231,0
"https://m.media-amazon.com/images/M/MV5BZmU0M2Y1OGUtZjIxNi00ZjBkLTg1MjgtOWIyNThiZWIwYjRiXkEyXkFqcGdeQXVyMTQxNzMzNDI@._V1_UX67_CR0,0,67,98_AL_.jpg",Back to the Future,1985,U,116,"Adventure, Comedy, Sci-Fi",8.5,"Marty McFly, a 17-year-old high school student, is accidentally sent thirty years into the past in a time-traveling DeLorean invented by his close friend, the eccentric scientist Doc Brown.",87,Robert Zemeckis,1951-05-14,USA,21,1058081,210.609.762
"https://m.media-amazon.com/images/M/MV5BZGI5MjBmYzYtMzJhZi00NGI1LTk3MzItYjBjMzcxM2U3MDdiXkEyXkFqcGdeQXVyNzkwMjQ5NzM@._V1_UX67_CR0,0,67,98_AL_.jpg",Once Upon a Time in the West,1968,U,165,Western,8.5,A mysterious stranger with a harmonica joins forces with a notorious desperado to protect a beautiful widow from a ruthless assassin working for the railroad.,80,Sergio Leone,1929-04-30,Italy,12,302844,5.321.508
"https://m.media-amazon.com/images/M/MV5BNTQwNDM1YzItNDAxZC00NWY2LTk0M2UtNDIwNWI5OGUyNWUxXkEyXkFqcGdeQXVyNzkwMjQ5NzM@._V1_UX67_CR0,0,67,98_AL_.jpg",Psycho,1960,A,109,"Horror, Mystery, Thriller",8.5,"A Phoenix secretary embezzles $40,000 from her employer's client, goes on the run, and checks into a remote motel run by a young man under the doation of his mother.",97,Alfred Hitchcock,1899-08-13,UK,53,604211,32.000.000
"https://m.media-amazon.com/images/M/MV5BY2IzZGY2YmEtYzljNS00NTM5LTgwMzUtMzM1NjQ4NGI0OTk0XkEyXkFqcGdeQXVyNDYyMDk5MTU@._V1_UX67_CR0,0,67,98_AL_.jpg",Casablanca,1942,U,102,"Drama, Romance, War",8.5,A cynical expatriate American cafe owner struggles to decide whether or not to help his former lover and her fugitive husband escape the Nazis in French Morocco.,100,Michael Curtiz,1886-12-24,Hungary,172,522093,1.024.560
"https://m.media-amazon.com/images/M/MV5BYjJiZjMzYzktNjU0NS00OTkxLWEwYzItYzdhYWJjN2QzMTRlL2ltYWdlL2ltYWdlXkEyXkFqcGdeQXVyNjU0OTQ0OTY@._V1_UX67_CR0,0,67,98_AL_.jpg",Modern Times,1936,G,87,"Comedy, Drama, Family",8.5,The Tramp struggles to live in modern industrial society with the help of a young homeless woman.,96,Charles Chaplin,1889-04-16,UK,80,217881,163.245
"https://m.media-amazon.com/images/M/MV5BY2I4MmM1N2EtM2YzOS00OWUzLTkzYzctNDc5NDg2N2IyODJmXkEyXkFqcGdeQXVyNzkwMjQ5NzM@._V1_UX67_CR0,0,67,98_AL_.jpg",City Lights,1931,G,87,"Comedy, Drama, Romance",8.5,"With the aid of a wealthy erratic tippler, a dewy-eyed tramp who has fallen in love with a sightless flower girl accumulates money to be able to help her medically.",99,Charles Chaplin,1889-04-16,UK,80,167839,19.181
"https://m.media-amazon.com/images/M/MV5BMmExNzU2ZWMtYzUwYi00YmM2LTkxZTQtNmVhNjY0NTMyMWI2XkEyXkFqcGdeQXVyMTMxODk2OTU@._V1_UX67_CR0,0,67,98_AL_.jpg",Capharnaüm,2018,A,126,Drama,8.4,"While serving a five-year sentence for a violent crime, a 12-year-old boy sues his parents for neglect.",75,Nadine Labaki,1974-02-18,Lebanon,4,62635,1.661.096
"https://m.media-amazon.com/images/M/MV5BNWJhMDlmZGUtYzcxNS00NDRiLWIwNjktNDY1Mjg3ZjBkYzY0XkEyXkFqcGdeQXVyMTU4MjUwMjI@._V1_UY98_CR2,0,67,98_AL_.jpg",Ayla: The Daughter of War,2017,,125,"Biography, Drama, History",8.4,"In 1950, amid-st the ravages of the Korean War, Sergeant Süleyman stumbles upon a half-frozen little girl, with no parents and no help in sight. Frantic, scared and on the verge of death, ...                See full summary »",67,Can Ulkay,1964-11-27,Turkey,7,34112,0
"https://m.media-amazon.com/images/M/MV5BY2FiMTFmMzMtZDI2ZC00NDQyLWExYTUtOWNmZWM1ZDg5YjVjXkEyXkFqcGdeQXVyODIwMDI1NjM@._V1_UX67_CR0,0,67,98_AL_.jpg",Vikram Vedha,2017,UA,147,"Action, Crime, Drama",8.4,"Vikram, a no-nonsense police officer, accompanied by Simon, his partner, is on the hunt to capture Vedha, a smuggler and a murderer. Vedha tries to change Vikram's life, which leads to a conflict.",80,Gayatri,1900-01-01,India,1,28401,0
"https://m.media-amazon.com/images/M/MV5BODRmZDVmNzUtZDA4ZC00NjhkLWI2M2UtN2M0ZDIzNDcxYThjL2ltYWdlXkEyXkFqcGdeQXVyNTk0MzMzODA@._V1_UX67_CR0,0,67,98_AL_.jpg",Kimi no na wa.,2016,U,106,"Animation, Drama, Fantasy",8.4,"Two strangers find themselves linked in a bizarre way. When a connection forms, will distance be the only thing to keep them apart?",79,Makoto Shinkai,1973-02-09,Japan,7,194838,5.017.246
"https://m.media-amazon.com/images/M/MV5BMTQ4MzQzMzM2Nl5BMl5BanBnXkFtZTgwMTQ1NzU3MDI@._V1_UY98_CR1,0,67,98_AL_.jpg",Dangal,2016,U,161,"Action, Biography, Drama",8.4,Former wrestler Mahavir Singh Phogat and his two wrestler daughters struggle towards glory at the Commonwealth Games in the face of societal oppression.,68,Nitesh Tiwari,1972-05-22,India,3,156479,12.391.761
"https://m.media-amazon.com/images/M/MV5BMjMwNDkxMTgzOF5BMl5BanBnXkFtZTgwNTkwNTQ3NjM@._V1_UX67_CR0,0,67,98_AL_.jpg",Spider-Man: Into the Spider-Verse,2018,U,117,"Animation, Action, Adventure",8.4,"Teen Miles Morales becomes the Spider-Man of his universe, and must join with five spider-powered individuals from other dimensions to stop a threat for all realities.",87,Bob Persichetti,1973-01-17,USA,1,375110,190.241.310
"https://m.media-amazon.com/images/M/MV5BMTc5MDE2ODcwNV5BMl5BanBnXkFtZTgwMzI2NzQ2NzM@._V1_UX67_CR0,0,67,98_AL_.jpg",Avengers: Endgame,2019,UA,181,"Action, Adventure, Drama",8.4,"After the devastating events of Avengers: Infinity War (2018), the universe is in ruins. With the help of remaining allies, the Avengers assemble once more in order to reverse Thanos' actions and restore balance to the universe.",78,Anthony Russo,1970-02-03,USA,7,809955,858.373.000
"https://m.media-amazon.com/images/M/MV5BMjMxNjY2MDU1OV5BMl5BanBnXkFtZTgwNzY1MTUwNTM@._V1_UX67_CR0,0,67,98_AL_.jpg",Avengers: Infinity War,2018,UA,149,"Action, Adventure, Sci-Fi",8.4,The Avengers and their allies must be willing to sacrifice all in an attempt to defeat the powerful Thanos before his blitz of devastation and ruin puts an end to the universe.,68,Anthony Russo,1970-02-03,USA,7,834477,678.815.482
"https://m.media-amazon.com/images/M/MV5BYjQ5NjM0Y2YtNjZkNC00ZDhkLWJjMWItN2QyNzFkMDE3ZjAxXkEyXkFqcGdeQXVyODIxMzk5NjA@._V1_UY98_CR1,0,67,98_AL_.jpg",Coco,2017,U,105,"Animation, Adventure, Family",8.4,"Aspiring musician Miguel, confronted with his family's ancestral ban on music, enters the Land of the Dead to find his great-great-grandfather, a legendary singer.",81,Lee Unkrich,1967-08-08,USA,4,384171,209.726.015
