Poster_Link,Series_Title,Released_Year,Certificate,Runtime,Genre,IMDB_Rating,Overview,Meta_score,Director,Director_DOB,Director_Country_Origin,Director_Movies_directed,No_of_Votes,Gross
"https://m.media-amazon.com/images/M/MV5BMjIyNTQ5NjQ1OV5BMl5BanBnXkFtZTcwODg1MDU4OA@@._V1_UX67_CR0,0,67,98_AL_.jpg",Django Unchained,2012,A,165,"Drama, Western",8.4,"With the help of a German bounty hunter, a freed slave sets out to rescue his wife from a brutal Mississippi plantation owner.",81,Quentin Tarantino,1963-03-27,USA,10,1357682,162.805.434
"https://m.media-amazon.com/images/M/MV5BMTk4ODQzNDY3Ml5BMl5BanBnXkFtZTcwODA0NTM4Nw@@._V1_UX67_CR0,0,67,98_AL_.jpg",The Dark Knight Rises,2012,UA,164,"Action, Adventure",8.4,"Eight years after the Joker's reign of anarchy, Batman, with the help of the enigmatic Catwoman, is forced from his exile to save Gotham City from the brutal guerrilla terrorist Bane.",78,Christopher Nolan,1970-07-30,UK,10,1516346,448.139.099
"https://m.media-amazon.com/images/M/MV5BNTkyOGVjMGEtNmQzZi00NzFlLTlhOWQtODYyMDc2ZGJmYzFhXkEyXkFqcGdeQXVyNjU0OTQ0OTY@._V1_UY98_CR0,0,67,98_AL_.jpg",3 Idiots,2009,UA,170,"Comedy, Drama",8.4,"Two friends are searching for their long lost companion. They revisit their college days and recall the memories of their friend who inspired them to think differently, even as the rest of the world called them ""idiots"".",67,Rajkumar Hirani,1962-11-20,India,5,344445,6.532.908
"https://m.media-amazon.com/images/M/MV5BMDhjZWViN2MtNzgxOS00NmI4LThiZDQtZDI3MzM4MDE4NTc0XkEyXkFqcGdeQXVyMTMxODk2OTU@._V1_UY98_CR1,0,67,98_AL_.jpg",Taare Zameen Par,2007,U,165,"Drama, Family",8.4,"An eight-year-old boy is thought to be a lazy trouble-maker, until the new art teacher has the patience and compassion to discover the real problem behind his struggles in school.",68,Aamir Khan,1965-03-14,India,1,168895,1.223.869
"https://m.media-amazon.com/images/M/MV5BMjExMTg5OTU0NF5BMl5BanBnXkFtZTcwMjMxMzMzMw@@._V1_UX67_CR0,0,67,98_AL_.jpg",WALL·E,2008,U,98,"Animation, Adventure, Family",8.4,"In the distant future, a small waste-collecting robot inadvertently embarks on a space journey that will ultimately decide the fate of mankind.",95,Andrew Stanton,1965-12-03,USA,5,999790,223.808.164
"https://m.media-amazon.com/images/M/MV5BOThkM2EzYmMtNDE3NS00NjlhLTg4YzktYTdhNzgyOWY3ZDYzXkEyXkFqcGdeQXVyNzQzNzQxNzI@._V1_UY98_CR1,0,67,98_AL_.jpg",The Lives of Others,2006,A,137,"Drama, Mystery, Thriller",8.4,"In 1984 East Berlin, an agent of the secret police, conducting surveillance on a writer and his lover, finds himself becoming increasingly absorbed by their lives.",89,Florian Henckel von Donnersmarck,1973-05-02,Germany,3,358685,11.286.112
"https://m.media-amazon.com/images/M/MV5BMTI3NTQyMzU5M15BMl5BanBnXkFtZTcwMTM2MjgyMQ@@._V1_UX67_CR0,0,67,98_AL_.jpg",Oldeuboi,2003,A,101,"Action, Drama, Mystery",8.4,"After being kidnapped and imprisoned for fifteen years, Oh Dae-Su is released, only to find that he must find his captor in five days.",77,Chan-wook Park,1963-08-23,South Korea,11,515451,707.481
"https://m.media-amazon.com/images/M/MV5BZTcyNjk1MjgtOWI3Mi00YzQwLWI5MTktMzY4ZmI2NDAyNzYzXkEyXkFqcGdeQXVyNjU0OTQ0OTY@._V1_UX67_CR0,0,67,98_AL_.jpg",Memento,2000,UA,113,"Mystery, Thriller",8.4,A man with short-term memory loss attempts to track down his wife's murderer.,80,Christopher Nolan,1970-07-30,UK,10,1125712,25.544.867
"https://m.media-amazon.com/images/M/MV5BNGIzY2IzODQtNThmMi00ZDE4LWI5YzAtNzNlZTM1ZjYyYjUyXkEyXkFqcGdeQXVyODEzNjM5OTQ@._V1_UX67_CR0,0,67,98_AL_.jpg",Mononoke-hime,1997,U,134,"Animation, Action, Adventure",8.4,"On a journey to find the cure for a Tatarigami's curse, Ashitaka finds himself in the middle of a war between the forest gods and Tatara, aing colony. In this quest he also meets San, the Mononoke Hime.",76,Hayao Miyazaki,1941-01-05,Japan,11,343171,2.375.308
"https://m.media-amazon.com/images/M/MV5BMGFkNWI4MTMtNGQ0OC00MWVmLTk3MTktOGYxN2Y2YWVkZWE2XkEyXkFqcGdeQXVyNjU0OTQ0OTY@._V1_UX67_CR0,0,67,98_AL_.jpg",Once Upon a Time in America,1984,A,229,"Crime, Drama",8.4,"A former Prohibition-era Jewish gangster returns to the Lower East Side of Manhattan over thirty years later, where he once again must confront the ghosts and regrets of his old life.",79,Sergio Leone,1989-04-30,Italy,12,311365,5.321.508
"https://m.media-amazon.com/images/M/MV5BMjA0ODEzMTc1Nl5BMl5BanBnXkFtZTcwODM2MjAxNA@@._V1_UX67_CR0,0,67,98_AL_.jpg",Raiders of the Lost Ark,1981,A,115,"Action, Adventure",8.4,"In 1936, archaeologist and adventurer Indiana Jones is hired by the U.S. government to find the Ark of the Covenant before Adolf Hitler's Nazis can obtain its awesome powers.",85,Steven Spielberg,1946-12-18,USA,34,884112,248.159.971
"https://m.media-amazon.com/images/M/MV5BZWFlYmY2MGEtZjVkYS00YzU4LTg0YjQtYzY1ZGE3NTA5NGQxXkEyXkFqcGdeQXVyMTQxNzMzNDI@._V1_UX67_CR0,0,67,98_AL_.jpg",The Shining,1980,A,146,"Drama, Horror",8.4,"A family heads to an isolated hotel for the winter where a sinister presence influences the father into violence, while his psychic son sees horrific forebodings from both past and future.",66,Stanley Kubrick,1928-07-26,USA,16,898237,44.017.374
"https://m.media-amazon.com/images/M/MV5BMDdhODg0MjYtYzBiOS00ZmI5LWEwZGYtZDEyNDU4MmQyNzFkXkEyXkFqcGdeQXVyNzkwMjQ5NzM@._V1_UX67_CR0,0,67,98_AL_.jpg",Apocalypse Now,1979,R,147,"Drama, Mystery, War",8.4,A U.S. Army officer serving in Vietnam is tasked with assassinating a renegade Special Forces Colonel who sees himself as a god.,94,Francis Ford Coppola,1939-04-07,USA,6,606398,83.471.511
"https://m.media-amazon.com/images/M/MV5BMmQ2MmU3NzktZjAxOC00ZDZhLTk4YzEtMDMyMzcxY2IwMDAyXkEyXkFqcGdeQXVyNzkwMjQ5NzM@._V1_UX67_CR0,0,67,98_AL_.jpg",Alien,1979,R,117,"Horror, Sci-Fi",8.4,"After a space merchant vessel receives an unknown transmission as a distress call, one of the crew is attacked by a mysterious life form and they soon realize that its life cycle has merely begun.",89,Ridley Scott,1937-11-30,UK,27,787806,78.900.000
"https://m.media-amazon.com/images/M/MV5BYmYzNmM2MDctZGY3Yi00NjRiLWIxZjctYjgzYTcxYTNhYTMyXkEyXkFqcGdeQXVyMjUxMTY3ODM@._V1_UY98_CR1,0,67,98_AL_.jpg",Anand,1971,U,122,"Drama, Musical",8.4,"The story of a terminally ill man who wishes to live life to the fullest before the inevitable occurs, as told by his best friend.",89,Hrishikesh Mukherjee,1922-09-30,India,42,30273,0
"https://m.media-amazon.com/images/M/MV5BOTI4NTNhZDMtMWNkZi00MTRmLWJmZDQtMmJkMGVmZTEzODlhXkEyXkFqcGdeQXVyNjc1NTYyMjg@._V1_UX67_CR0,0,67,98_AL_.jpg",Tengoku to jigoku,1963,,143,"Crime, Drama, Mystery",8.4,An executive of a shoe company becomes a victim of extortion when his chauffeur's son is kidnapped and held for ransom.,75,Akira Kurosawa,1910-03-23,Japan,30,34357,0
"https://m.media-amazon.com/images/M/MV5BZWI3ZTMxNjctMjdlNS00NmUwLWFiM2YtZDUyY2I3N2MxYTE0XkEyXkFqcGdeQXVyNzkwMjQ5NzM@._V1_UX67_CR0,0,67,98_AL_.jpg",Dr. Strangelove or: How I Learned to Stop Worrying and Love the Bomb,1964,A,95,Comedy,8.4,An insane general triggers a path to nuclear holocaust that a War Room full of politicians and generals frantically tries to stop.,97,Stanley Kubrick,1928-07-26,USA,16,450474,275.902
"https://m.media-amazon.com/images/M/MV5BNDQwODU5OWYtNDcyNi00MDQ1LThiOGMtZDkwNWJiM2Y3MDg0XkEyXkFqcGdeQXVyMDI2NDg0NQ@@._V1_UX67_CR0,0,67,98_AL_.jpg",Witness for the Prosecution,1957,U,116,"Crime, Drama, Mystery",8.4,A veteran British barrister must defend his client in a murder trial that has surprise after surprise.,76,Billy Wilder,1906-06-22,Austria,27,108862,8.175.000
"https://m.media-amazon.com/images/M/MV5BNjViMmRkOTEtM2ViOS00ODg0LWJhYWEtNTBlOGQxNDczOGY3XkEyXkFqcGdeQXVyMDI2NDg0NQ@@._V1_UY98_CR2,0,67,98_AL_.jpg",Paths of Glory,1957,A,88,"Drama, War",8.4,"After refusing to attack an enemy position, a general accuses the soldiers of cowardice and their commanding officer must defend them.",90,Stanley Kubrick,1928-07-26,USA,16,178092,0
"https://m.media-amazon.com/images/M/MV5BNGUxYWM3M2MtMGM3Mi00ZmRiLWE0NGQtZjE5ODI2OTJhNTU0XkEyXkFqcGdeQXVyMTQxNzMzNDI@._V1_UX67_CR0,0,67,98_AL_.jpg",Rear Window,1954,U,112,"Mystery, Thriller",8.4,A wheelchair-bound photographer spies on his neighbors from his apartment window and becomes convinced one of them has committed murder.,100,Alfred Hitchcock,1899-08-13,UK,53,444074,36.764.313
"https://m.media-amazon.com/images/M/MV5BMTU0NTkyNzYwMF5BMl5BanBnXkFtZTgwMDU0NDk5MTI@._V1_UX67_CR0,0,67,98_AL_.jpg",Sunset Blvd.,1950,Passed,110,"Drama, Film-Noir",8.4,A screenwriter develops a dangerous relationship with a faded film star determined to make a triumphant return.,84,Billy Wilder,1906-06-22,Austria,27,201632,0
"https://m.media-amazon.com/images/M/MV5BMmExYWJjNTktNGUyZS00ODhmLTkxYzAtNWIzOGEyMGNiMmUwXkEyXkFqcGdeQXVyNjU0OTQ0OTY@._V1_UX67_CR0,0,67,98_AL_.jpg",The Great Dictator,1940,Passed,125,"Comedy, Drama, War",8.4,Dictator Adenoid Hynkel tries to expand his empire while a poor Jewish barber tries to avoid persecution from Hynkel's regime.,83,Charles Chaplin,1889-04-16,UK,80,203150,288.475
"https://m.media-amazon.com/images/M/MV5BOTdmNTFjNDEtNzg0My00ZjkxLTg1ZDAtZTdkMDc2ZmFiNWQ1XkEyXkFqcGdeQXVyNTAzNzgwNTg@._V1_UX67_CR0,0,67,98_AL_.jpg",1917,2019,R,119,"Drama, Thriller, War",8.3,"April 6th, 1917. As a regiment assembles to wage war deep in enemy territory, two soldiers are assigned to race against time and deliver a message that will stop 1,600 men from walking straight into a deadly trap.",78,Sam Mendes,1965-08-01,UK,10,425844,159.227.644
"https://m.media-amazon.com/images/M/MV5BYmQxNmU4ZjgtYzE5Mi00ZDlhLTlhOTctMzJkNjk2ZGUyZGEwXkEyXkFqcGdeQXVyMzgxMDA0Nzk@._V1_UY98_CR1,0,67,98_AL_.jpg",Tumbbad,2018,A,104,"Drama, Fantasy, Horror",8.3,A mythological story about a goddess who created the entire universe. The plot revolves around the consequences when humans build a temple for her first-born.,76,Rahi Anil Barve,1979-06-04,India,1,27793,0
"https://m.media-amazon.com/images/M/MV5BZWZhMjhhZmYtOTIzOC00MGYzLWI1OGYtM2ZkN2IxNTI4ZWI3XkEyXkFqcGdeQXVyNDAzNDk0MTQ@._V1_UY98_CR0,0,67,98_AL_.jpg",Andhadhun,2018,UA,139,"Crime, Drama, Music",8.3,"A series of mysterious events change the life of a blind pianist, who must now report a crime that he should technically know nothing of.",91,Sriram Raghavan,1963-06-22,India,7,71875,1.373.943
"https://m.media-amazon.com/images/M/MV5BYmY3MzYwMGUtOWMxYS00OGVhLWFjNmUtYzlkNGVmY2ZkMjA3XkEyXkFqcGdeQXVyMTExNDQ2MTI@._V1_UY98_CR4,0,67,98_AL_.jpg",Drishyam,2013,U,160,"Crime, Drama, Thriller",8.3,A man goes to extreme lengths to save his family from punishment after the family commits an accidental crime.,83,Jeethu Joseph,1972-11-10,India,11,30722,0
"https://m.media-amazon.com/images/M/MV5BMTg2NDg3ODg4NF5BMl5BanBnXkFtZTcwNzk3NTc3Nw@@._V1_UY98_CR1,0,67,98_AL_.jpg",Jagten,2012,R,115,Drama,8.3,"A teacher lives a lonely life, all the while struggling over his son's custody. His life slowly gets better as he finds love and receives good news from his son, but his new luck is about to be brutally shattered by an innocent little lie.",77,Thomas Vinterberg,1969-05-19,Denmark,13,281623,687.185
"https://m.media-amazon.com/images/M/MV5BN2JmMjViMjMtZTM5Mi00ZGZkLTk5YzctZDg5MjFjZDE4NjNkXkEyXkFqcGdeQXVyMTMxODk2OTU@._V1_UX67_CR0,0,67,98_AL_.jpg",Jodaeiye Nader az Simin,2011,PG-13,123,Drama,8.3,A married couple are faced with a difficult decision - to improve the life of their child by moving to another country or to stay in Iran and look after a deteriorating parent who has Alzheimer's disease.,95,Asghar Farhadi,1972-05-07,Iran,8,220002,7.098.492
"https://m.media-amazon.com/images/M/MV5BMWE3MGYzZjktY2Q5Mi00Y2NiLWIyYWUtMmIyNzA3YmZlMGFhXkEyXkFqcGdeQXVyMTMxODk2OTU@._V1_UX67_CR0,0,67,98_AL_.jpg",Incendies,2010,R,131,"Drama, Mystery, War",8.3,Twins journey to the Middle East to discover their family history and fulfill their mother's last wishes.,80,Denis Villeneuve,1967-10-03,Canada,12,150023,6.857.096
"https://m.media-amazon.com/images/M/MV5BOGE3N2QxN2YtM2ZlNS00MWIyLWE1NDAtYWFlN2FiYjY1MjczXkEyXkFqcGdeQXVyOTUwNzc0ODc@._V1_UY98_CR1,0,67,98_AL_.jpg",Miracle in cell NO.7,2019,TV-14,132,Drama,8.3,A story of love between a mentally-ill father who was wrongly accused of murder and his lovely six years old daughter. The prison would be their home. Based on the 2013 Korean movie 7-beon-bang-ui seon-mul (2013).,74,Mehmet Ada Öztekin,1976-01-01,Turkey,8,33935,0
"https://m.media-amazon.com/images/M/MV5BNjAzMzEwYzctNjc1MC00Nzg5LWFmMGItMTgzYmMyNTY2OTQ4XkEyXkFqcGdeQXVyNjU0OTQ0OTY@._V1_UY98_CR0,0,67,98_AL_.jpg",Babam ve Oglum,2005,,112,"Drama, Family",8.3,The family of a left-wing journalist is torn apart after the military coup of Turkey in 1980.,69,Çagan Irmak,1970-04-04,Turkey,10,78925,0
"https://m.media-amazon.com/images/M/MV5BOTJiNDEzOWYtMTVjOC00ZjlmLWE0NGMtZmE1OWVmZDQ2OWJhXkEyXkFqcGdeQXVyNTIzOTk5ODM@._V1_UX67_CR0,0,67,98_AL_.jpg",Inglourious Basterds,2009,A,153,"Adventure, Drama, War",8.3,"In Nazi-occupied France during World War II, a plan to assassinate Nazi leaders by a group of Jewish U.S. soldiers coincides with a theatre owner's vengeful plans for the same.",69,Quentin Tarantino,1963-03-27,USA,10,1267869,120.540.719
"https://m.media-amazon.com/images/M/MV5BMTY4NzcwODg3Nl5BMl5BanBnXkFtZTcwNTEwOTMyMw@@._V1_UX67_CR0,0,67,98_AL_.jpg",Eternal Sunshine of the Spotlessd,2004,UA,108,"Drama, Romance, Sci-Fi",8.3,"When their relationship turns sour, a couple undergoes a medical procedure to have each other erased from their memories.",89,Michel Gondry,1963-05-08,France,16,911664,34.400.301
"https://m.media-amazon.com/images/M/MV5BNDg4NjM1YjMtYmNhZC00MjM0LWFiZmYtNGY1YjA3MzZmODc5XkEyXkFqcGdeQXVyNDk3NzU2MTQ@._V1_UX67_CR0,0,67,98_AL_.jpg",Amélie,2001,U,122,"Comedy, Romance",8.3,"Amélie is an innocent and naive girl in Paris with her own sense of justice. She decides to help those around her and, along the way, discovers love.",69,Jean-Pierre Jeunet,1953-09-03,France,11,703810,33.225.499
"https://m.media-amazon.com/images/M/MV5BMTA2NDYxOGYtYjU1Mi00Y2QzLTgxMTQtMWI1MGI0ZGQ5MmU4XkEyXkFqcGdeQXVyNDk3NzU2MTQ@._V1_UY98_CR0,0,67,98_AL_.jpg",Snatch,2000,UA,104,"Comedy, Crime",8.3,"Unscrupulous boxing promoters, violent bookmakers, a Russian gangster, incompetent amateur robbers and supposedly Jewish jewelers fight to track down a priceless stolen diamond.",55,Guy Ritchie,1968-09-10,UK,13,782001,30.328.156
"https://m.media-amazon.com/images/M/MV5BOTdiNzJlOWUtNWMwNS00NmFlLWI0YTEtZmI3YjIzZWUyY2Y3XkEyXkFqcGdeQXVyNjU0OTQ0OTY@._V1_UX67_CR0,0,67,98_AL_.jpg",Requiem for a Dream,2000,A,102,Drama,8.3,The drug-induced utopias of four Coney Island people are shattered when their addictions run deep.,68,Darren Aronofsky,1969-02-12,USA,8,766870,3.635.482
"https://m.media-amazon.com/images/M/MV5BNTBmZWJkNjctNDhiNC00MGE2LWEwOTctZTk5OGVhMWMyNmVhXkEyXkFqcGdeQXVyMTMxODk2OTU@._V1_UX67_CR0,0,67,98_AL_.jpg",American Beauty,1999,UA,122,Drama,8.3,A sexually frustrated suburban father has a mid-life crisis after becoming infatuated with his daughter's best friend.,84,Sam Mendes,1965-08-01,UK,10,1069738,130.096.601
"https://m.media-amazon.com/images/M/MV5BZTYwZWQ4ZTQtZWU0MS00N2YwLWEzMDItZWFkZWY0MWVjODVhXkEyXkFqcGdeQXVyNjU0OTQ0OTY@._V1_UX67_CR0,0,67,98_AL_.jpg",Bacheha-Ye aseman,1997,PG,89,"Drama, Family, Sport",8.3,"After a boy loses his sister's pair of shoes, he goes on a series of adventures in order to find them. When he can't, he tries a new way to ""win"" a new pair.",77,Majid Majidi,1959-04-17,Iran,1,65341,933.933
